articleSourceId,sourceUrl,title,englishAbstract,spanishAbstract,portugueseAbstract,owner,pais,producto,dateOfHit
mdl-39280452,https://pesquisa.bvsalud.org/portal/resource/es/mdl-39280452,Female With Hypertensive Emergency Later Found to Have ANCA-Associated Vasculitis: A Case Report.,"Granulomatosis with polyangiitis (GPA) is a form of ANCA-associated vasculitis characterized by necrotizing vasculitis affecting small blood vessels. The clinical presentation varies based on organ involvement, commonly affecting the upper and lower respiratory tracts and kidneys. Typical GPA presents as recurrent sinus infection, otitis media, dyspnea, chest pain, and glomerulonephritis, which can present as hematuria, proteinuria, and elevated serum creatinine. ANCA tests positive in the majority of cases. Treatment strategies involve induction of remission and maintenance therapy. We report a case of a 48-year-old female presenting with a hypertensive emergency, a rarely reported manifestation of GPA. She initially presented with severe headache and cough, with systolic blood pressure exceeding 220 mmHg, necessitating hospital admission. The initial workup revealed elevated serum creatinine and CT chest findings suggestive of multi-lobar pneumonia, for which she received antibiotic treatment. Despite aggressive antihypertensive therapy, her blood pressure remained refractory, and she developed hematuria and anemia, requiring a blood transfusion. Further evaluation revealed a history of joint pain, recurrent sinus infections, and a pruritic skin rash, prompting suspicion of vasculitis. Further work-up included elevated erythrocyte sedimentation rate (ESR), normal IgE, absence of eosinophilia, and positive PR3 antibodies and c-ANCA. Prompted by clinical suspicion, treatment with steroids was initiated, and a kidney biopsy confirmed acute necrotizing pauci-immune glomerulonephritis consistent with GPA. Subsequently, rituximab therapy was initiated, resulting in significant improvement in her clinical symptoms and blood pressure, and the patient was successfully discharged home. This case highlights a rare presentation of GPA as a hypertensive emergency, possibly linked to renal involvement in the form of glomerulonephritis. Pulmonary manifestations mimicking infections posed diagnostic challenges. Cutaneous findings potentially associated with increased joint and renal involvement underscore the clinical complexity of GPA. The unusual presentation of hypertensive emergency in young patients underscores the need for heightened awareness of this potential manifestation in GPA. Early recognition and aggressive immunosuppressive therapy are crucial to mitigate irreversible renal damage in such atypical presentations.","","",ELEA,Argentina,NOVEX,2024-09-02
mdl-39321406,https://pesquisa.bvsalud.org/portal/resource/es/mdl-39321406,Anti-CD20 Therapies in Drug-Naive Patients With Primary Progressive Multiple Sclerosis: A Multicenter Real-Life Study.,"BACKGROUND AND OBJECTIVES: Although rituximab failed to demonstrate a significant effect on disability progression in primary progressive multiple sclerosis (PPMS), ocrelizumab succeeded. Our main objective was to analyze confirmed disability progression (CDP) in a cohort of patients with PPMS treated with anti-CD20 therapies compared with a weighted untreated control cohort. METHODS: This was a retrospective study using data from the French MS registry (Observatoire Français de la Sclérose En Plaques). We included patients with PPMS treated or never treated with anti-CD20 therapies from 2016 to 2021, with an Expanded Disability Status Scale score of ≤6.5 at baseline. The primary outcome was time to first CDP. The secondary outcomes were time to first relapse, MRI activity at 2 years, identification of risk factors associated with CDP, and serious infection incidence rates (IIRs). Each outcome was studied using an inverse probability of treatment weighting method. The outcomes were modeled using a weighted proportional Cox model for the time-to-event outcomes and by a logistic regression regarding the MRI activity. RESULTS: A total of 1,184 patients (426 treated and 758 untreated) fulfilled the inclusion criteria. Median age (Q1-Q3) was 56 years (49.3-63.8), and 52.7% were female. Among treated patients, 295 received rituximab, whereas 131 received ocrelizumab. At baseline, anti-CD20-treated patients were younger (median 51.9 vs 58.6 years, Cohen d = 0.683) and had more active disease (54.5 vs 27.8%, Cohen d = 0.562). 91.6% were drug-naive at inclusion. In time to first CDP analysis, no statistical significance was observed (hazard ratio [HR], 1.13; 95% CI 0.93-1.36, p = 0.2113). In time to first relapse analysis, a nonsignificant trend toward fewer patients relapsing in the treated group was observed (HR 0.83; 95% CI 0.48-1.28, p = 0.0809). For MRI activity, no significant difference was found between the 2 groups. Risk factors associated with CDP in the treated group were male sex and MS duration. IIR was 6.67 (95% CI 3.12-14.25) per 100 person-years in the treated group vs 2.67 (95% CI 0.80-8.86) in the untreated group. DISCUSSION: Time to first CDP was not different between anti-CD20 treated and untreated patients with PPMS. Although our study is retrospective and mainly included patients treated by rituximab, our results indicate that there should be a constant evaluation of all available data to ascertain the best risk/benefit ratio for patients with PPMS. CLASSIFICATION OF EVIDENCE: This study provides Class III evidence that anti-CD20 therapy of previously untreated patients with PPMS was not superior to no therapy in delaying time to first CDP.","","",ELEA,Argentina,NOVEX,2024-09-02
mdl-39324011,https://pesquisa.bvsalud.org/portal/resource/es/mdl-39324011,Outcomes and toxicities in patients with diffuse-large B cell lymphoma involving the gastrointestinal tract and digestive organs.,"Background: Diffuse large B-cell lymphoma (DLBCL) involving the gastrointestinal (GI) organs is rare, and real-world outcomes after combined modality therapy (CMT) with systemic therapy (ST) and radiotherapy (RT) are not well-characterized, particularly in the contemporary era. We characterized outcomes in a large cohort of GI-DLBCL patients treated with ST alone or CMT. Methods: Patients with GI-DLBCL treated at a single institution were retrospectively reviewed. Kaplan-Meier and Cox regression models estimated survival. Multivariable analyses were conducted using the Cox proportional hazards model. Results: Of 204 patients, gastric involvement was most common (63%). Most presented with early-stage disease (61%). All patients received ST and 65 patients (32%) received RT, 88% as part of first-line CMT. Median dose was 36 Gy (IQR 30.6-39.6) in 18 fractions (IQR 17-22). Median follow-up was 46 months. Five-year overall survival (OS) and progression-free survival (PFS) was 88% and 84%, respectively; complete response (CR) rate was 82%. Improved OS associated with low IPI (p=0.001), fewer chemotherapy lines (p<0.001), early stage (p<0.006), and CR (p<0.001). Survival did not differ by RT receipt (p>0.25). Only early stage and CR correlated with improved OS on multivariable analysis. Stomach-directed RT vs. RT to other sites correlated with improved PFS and OS (p<0.04). Patients with early stage DLBCL treated with CMT in the post-rituximab era had equivalent OS vs. ST alone, even with fewer chemotherapy cycles (p<0.02; median of 4 with RT vs. 6 cycles without). Fifty patients had bulky disease (≥7.5 cm), of whom 18 (36%) had early stage disease. Among patients with bulky disease, 5 (10%) developed relapse at the initial site of disease bulk. Four of the 5 patients did not receive consolidative radiation. Among these 4 patients, 3 relapsed only in their initial site of bulky disease. Of 191 patients with luminal GI-DLBCL, n=4 (2.1%) developed perforation; only one received RT. Acute Grade 3 toxicities were reported in 41.2% of patients, and 12 (5.8%) patients had late Grade 3 toxicities, 99% attributed to chemotherapy. Conclusion: GI-DLBCL patients have favorable outcomes after CMT with minimal late toxicity. CMT may be offered with abridged systemic regimens with equivalent outcomes. Stomach directed-RT may mitigate relapse risk associated with incomplete disease response or bulky disease.","","",ELEA,Argentina,NOVEX,2024-09-02
mdl-39324574,https://pesquisa.bvsalud.org/portal/resource/es/mdl-39324574,Assessing disease activity in scleroderma-related interstitial lung disease: a review and practical guide to management.,"Systemic sclerosis (SSc) is a heterogeneous disease with a propensity to involve multiple organ systems. There is a significant proportion of these patients with interstitial lung disease (ILD) who are at risk of mortality and morbidity. There are limited available tools to assess the severity of parenchymal lung involvement and are subject to confounding factors, including the presence of pulmonary hypertension and concomitant smoking history. The diagnostic tools include careful clinical history, examination, thoracic imaging, and pulmonary function tests. One of the limitations of assessing disease severity in SSc-ILD is the lack of standardized definitions for disease activity and serum biomarkers to predict future progression. Although there has been significant progress in managing SSc-related ILD over the last couple of decades with a few randomized double-blind clinical trials assessing the role of immunosuppression (mainly Cyclophosphamide and Mycophenolate Mofetil), the efficacy of these therapies is at best modest and is associated with significant toxicities. Furthermore, Nintedanib has shown promise in reducing forced vital capacity decline in SSc-ILD and in progressive fibrotic-ILD of a range of etiologies. Data are emerging for therapies like Rituximab and Tocilizumab, and we are likely to see further evidence of similar drugs being efficacious in this disease cohort. A relatively simplified algorithm is proposed in this review to guide clinicians dealing with ILD and SSc. It is imperative that clinicians take a multi-disciplinary approach to managing this complex disease in a changing therapeutic landscape.","","",ELEA,Argentina,NOVEX,2024-09-02
mdl-39318924,https://pesquisa.bvsalud.org/portal/resource/es/mdl-39318924,Prognostic Factors for Mortality in Patients With Autoimmune Diseases Complicated by Pneumocystis Pneumonia.,"Objectives Pneumocystis pneumonia (PCP) has a poor prognosis in patients with autoimmune diseases. Additionally, the mortality of PCP in autoimmune diseases is higher than that of human immunodeficiency virus-PCP. Therefore, this study aimed to assess the risk factors associated with mortality in patients with autoimmune diseases complicated with PCP. Methods We conducted a retrospective observational study involving 38 patients treated for PCP at Showa University School of Medicine from January 2010 to August 2014. Diagnoses were established based on clinical symptoms, imaging, and laboratory tests, including hypoxemia (partial pressure of oxygen (PaO2) < 70 mmHg), chest computed tomography findings, elevated (1,3)-ß-D-glucan, and positive Pneumocystis jiroveciipolymerase chain reaction tests from sputum samples. Data regarding patient demographics, underlying diseases, therapeutic interventions, and laboratory findings were collected. Statistical comparisons between survivors and non-survivors were performed using Fisher's exact probability test and Mann-Whitney U test for independence test with Stata/SE version 17.0 (StataCorp LLC, College Station, TX). Results The median age of the study group was 72.4 years old, with the majority having rheumatoid arthritis. Mortality occurred in 18% (seven out of 38) of cases. Factors associated with increased mortality include males, higher serum creatinine and C-reactive protein levels, lower albumin and immunoglobulin A levels, and lower PaO2/fraction of inspired oxygen (FiO2) ratio. No significant difference was observed in the rate of intratracheal intubation, ICU management, and hospitalization period. Prophylactic administration of trimethoprim-sulfamethoxazole (TMP-SMX) was not performed in any of the cases. Conclusions This study examined the risk of mortality for PCP in patients with autoimmune diseases. The male gender, low IgA and albumin levels, low PaO2/FiO2 ratio, as well as high creatinine and CRP levels, were identified as significant factors for poor prognosis. These factors can help identify patients at high risk for PCP and guide the consideration of prophylactic TMP-SMX administration. They may also provide insights into when to discontinue prophylactic treatment. Future studies should investigate the administration of prophylactic TMP-SMX. Additionally, the risk of mortality for PCP under the administration of new biological agents, such as anifrolumab, belimumab, and rituximab, or immunosuppressants, such as mycophenolate mofetil and voclosporin, should be evaluated. These findings can contribute to improving PCP prevention and treatment strategies in patients with autoimmune diseases, ultimately leading to better patient outcomes.","","",ELEA,Argentina,NOVEX,2024-09-02
mdl-39234862,https://pesquisa.bvsalud.org/portal/resource/es/mdl-39234862,Safety and efficacy of acalabrutinib plus bendamustine and rituximab in patients with treatment-naive or relapsed / refractory mantle cell lymphoma: phase Ib trial.,"This multicenter, open-label, phase 1b study (ACE-LY-106) assessed the safety and efficacy of acalabrutinib, bendamustine, and rituximab (ABR) in treatment-naive (TN) and relapsed or refractory (R/R) mantle cell lymphoma (MCL). Patients received acalabrutinib from cycle 1 until disease progression or treatment discontinuation, bendamustine on days 1 and 2 of each cycle for up to 6 cycles, and rituximab on day 1 of each cycle for 6 cycles, continuing every other cycle from cycle 8 for 12 additional doses (TN cohort). Eighteen patients enrolled in the TN and 20 in the R/R cohort. Median duration of exposure to acalabrutinib was 34.0 and 14.6 months in the TN and R/R cohorts, respectively. No new safety risks were identified, and most adverse events (AEs) were grades 1 or 2. Thirteen patients from the TN cohort (72.2%) and 17 patients from the R/R cohort (85.0%) reported grade 3-4 AEs, most commonly neutropenia (TN: 38.9%, R/R: 50.0%). AEs leading to death were pneumonitis (n=1, TN cohort), COVID-19, and cerebrospinal meningitis (n=1 each, R/R cohort). Overall response was 94.4% and 85.0% in the TN and R/R cohorts, respectively; complete response rates were 77.8% and 70.0%, respectively. After a median follow-up of 47.6 months, median progression-free survival (PFS) and overall survival (OS) were not reached in the TN cohort. After a median follow-up of 20.4 months, median PFS was 28.6 months and OS was not reached in the R/R cohort. Results indicate that ABR was safe and efficacious, supporting further study in patients with TN MCL. ClinicalTrials.gov identifier: NCT02717624.","","",ELEA,Argentina,NOVEX,2024-09-02
mdl-39234863,https://pesquisa.bvsalud.org/portal/resource/es/mdl-39234863,Rituximab and lenalidomide for the treatment of relapsed or refractory indolent non-Hodgkin lymphoma: real-life experience.,"The combination of rituximab and lenalidomide (R-len) stands as an established treatment for relapsed/refractory (R/R) indolent non-Hodgkin lymphoma (iNHL). However, the reproducibility of clinical trial results in routine clinical practice is unknown. To address this gap in knowledge, we reviewed our experience with patients diagnosed with R/R follicular lymphoma (FL) or marginal zone lymphoma (MZL) treated with this combination. Eighty-four patients underwent treatment with R-len, 69 (82%) affected by FL and 15 (18%) by MZL. The median age at the time of treatment initiation was 65 years (range, 39-94), 38 patients (45%) had a pre-treatment FLIPI score of 3-5, 19 (23%) had a bulky disease, 29 (37%) had a lymphoma refractory to the last treatment line, while in 20 (24%) cases the disease was refractory to rituximab. The best overall response rate (ORR) was 82%, and 52% achieved a complete response (CR). The best CR rates for FL and MZL patients were 55% and 40%, respectively. With a median follow-up of 22 months, the median progression-free survival (mPFS) was 22 months (95% CI 19-36) and the 2-year overall survival (OS) was 83% (95% CI 74-93). The median duration of CR (DoCR) was 46 months (95% CI 22-NR). Factors associated with shorter PFS in multivariate analysis were bulky disease and rituximab refractoriness. The most common adverse events (AE) included hematologic toxicity, fatigue and gastrointestinal disorders, such as diarrhea and constipation. Neutropenia and thrombocytopenia were the most common severe toxicities (grade ≥3 in 25% and 4%, respectively). No new safety signals were reported. Real-life results of R-len in patients with R/R iNHL appear consistent with those reported in prospective studies, and further support its use as comparator arm in controlled clinical trials.","","",ELEA,Argentina,NOVEX,2024-09-02
mdl-39229411,https://pesquisa.bvsalud.org/portal/resource/es/mdl-39229411,"Efficacy and Safety of Bendamustine-Rituximab as Frontline Therapy for Indolent Non-Hodgkin Lymphoma: A Real-World, Single-Center, Retrospective Study.","Background The use of bendamustine with an anti-CD20 monoclonal antibody as frontline therapy for indolent non-Hodgkin lymphoma (NHL) has become a standard of care. We aimed to evaluate the real-world efficacy and safety of bendamustine-rituximab (BR) frontline therapy for indolent NHL. Patients and methods Patients with indolent NHL treated with frontline BR therapy in Hôpital du Sacré-Coeur de Montréal, from January 2015 to August 2018 were included in this retrospective study. Results Our cohort included 42 adults with a median age of 63 years. Follicular lymphoma was the most common histology (n = 31, 74%). Most patients had advanced disease (Lugano stage III or IV, 88%). The overall response rate was 84% (complete response = 62% and partial response = 22%). Median progression-free survival (PFS) was not reached. At 30 months, PFS was 74.8% and overall survival was 90%. Grade 3-4 neutropenia occurred in 21% of patients. Infection-related adverse events were observed in 17 patients (40%). Most were grade 1 and 2 events (84%). One case of grade 5 progressive multifocal leukoencephalopathy related to John Cunningham (JC) virus reactivation was observed. The most common non-infectious-related adverse events were mild nausea and fatigue. Conclusions The efficacy and safety of BR treatment for indolent NHL were comparable in our real-life cohort compared to prior studies. This supports BR as a standard of care for indolent NHL. Future studies should assess whether the use of granulocyte-colony stimulating factors as primary prophylaxis effectively mitigates the hematological and infection-related adverse events related to BR therapy.","","",ELEA,Argentina,NOVEX,2024-09-02
mdl-39267618,https://pesquisa.bvsalud.org/portal/resource/es/mdl-39267618,Antibody-Mediated Rejection in Liver Transplantation: Immuno-Pathological Characteristics and Long-Term Follow-Up.,"The diagnosis of liver antibody-mediated rejection (AMR) is challenging and likely under-recognized. The association of AMR with donor-specific antibodies (DSA), and its clinical course in relation to pathologic findings and treatment are ill defined. We identified cases of liver AMR by following the criteria outlined by the 2016 Banff Working Group. Patient demographics, native liver disease, histopathologic findings, treatment type, clinical outcome, and transaminase levels during AMR diagnosis, treatment, and resolution were determined. Patients (n = 8) with AMR average age was 55.2 years (range: 19-68). Seven of eight cases met the Banff criteria for AMR. Personalized treatment regimens consisted of optimization of immunosuppression, intravenous pulse steroids, plasmapheresis, IVIG, rituximab, and bortezomib. Five patients experienced complete resolution of AMR, return of transaminases to baseline, and decreased DSA at long-term follow-up. One patient developed chronic AMR and two patients required re-transplantation. Follow-up after AMR diagnosis ranged from one to 11 years. Because AMR can present at any time, crossmatch, early biopsy, and routine monitoring of DSA levels should be implemented following transaminase elevation to recognize AMR. Furthermore, treatment should be immediately implemented to reverse AMR and prevent graft failure, chronic damage, re-transplantation, and possibly mortality.","","",ELEA,Argentina,NOVEX,2024-09-02
mdl-39221403,https://pesquisa.bvsalud.org/portal/resource/es/mdl-39221403,Unusual Presentation of Aggressive Atypical Hemolytic Uremic Syndrome With Brugada Syndrome.,"Hemolytic uremic syndrome (HUS) is part of a spectrum of disorders known as thrombotic microangiopathies. These disorders are characterized by giving rise to platelet microthrombi, which subsequently develop hemolytic anemia and thrombocytopenia. In HUS, the kidneys are destroyed, mainly due to damage to the renal blood vessels. HUS can be typical or atypical, depending on the cause, and can lead to significant mortality rates. We herein report an unusual case of atypical HUS in a 15-year-old female who presented with fatigue, abdominal pain with nausea and vomiting, loss of appetite, and urine discoloration. Further tests showed low platelets with significant anemia. She was diagnosed with atypical HUS after discovering that she had no previous bloody diarrhea episode with a negative E. coli strain, O157:H7, alongside valid ADAMTS13 activity. The diagnosis was confirmed by genetic testing, and a variant of uncertain significance was found in the CFH gene. The patient, therefore, was started on eculizumab, and a follow-up was done once or twice a month through blood testing. She showed significant improvement. Due to non-compliance with the eculizumab treatment, the patient showed deterioration numerous times. A kidney biopsy was subsequently done, showing signs of acute to chronic thrombotic microangiopathy with moderate tubular atrophy and interstitial fibrosis. After many hemodialysis and plasma exchange sessions and being put on several treatments, such as prednisolone and rituximab, the patient faced death after one year.","","",ELEA,Argentina,NOVEX,2024-09-02
mdl-39236292,https://pesquisa.bvsalud.org/portal/resource/es/mdl-39236292,Incorporation of immunotherapy into frontline treatment for adults with B-cell precursor acute lymphoblastic leukemia.,"Although complete remission rates in adults with B-cell precursor acute lymphoblastic leukemia (BCP-ALL) have improved over the last two decades, it is still inferior to that of the pediatric population and once in remission, the risk of relapse is still high. Furthermore, while pediatric-inspired chemotherapy regimens have improved long-term outcomes for adolescents and young adults, these intensive chemotherapy regimens are not well tolerated in older patients and are associated with higher morbidity and mortality. Immunotherapeutic agents offer a potential opportunity to improve response and decrease relapse without increasing toxicity. The incorporation of rituximab (anti-CD20 monoclonal antibody) into chemotherapy regimens has been shown to improve outcomes. The treatment of BCP-ALL in adults has been transformed with the approval of inotuzumab ozogamicin (anti-CD22 antibody drug conjugate), blinatumomab (CD3/CD19 bispecific antibody construct), and CAR T-cells for relapsed or refractory disease, and of blinatumomab for measurable residual disease (MRD)-positive remission. More recently, studies of inotuzumab and blinatumomab have shown promising results when used upfront either with or without multiagent chemotherapy. Blinatumomab has also been shown in a randomized trial to provide a survival benefit in patients with MRD-negative first remission when added to chemotherapy which recently led to its additional FDA approval for use in consolidation. In this review, we highlight the evolution of chemoimmunotherapy-based treatment approaches in the management of treatment-naïve BCP-ALL.","","",ELEA,Argentina,NOVEX,2024-09-02
